{
  "conversationId": "urn:missionweave:conversation:implementation",
  "missionId": "urn:missionweave:mission:one",
  "groupId": "urn:missionweave:group:mission-one",
  "type": "work_item",
  "primaryWorkItemId": "urn:missionweave:work-item:implementation",
  "title": "Implementation WorkItem",
  "access": {"mode": "group"},
  "createdBy": {"type": "agent", "id": "urn:missionweave:agent:coordinator"},
  "createdAt": "2026-07-15T00:00:00Z",
  "state": "active",
  "revision": 1
}
